<?xml version="1.0" encoding="UTF-8"?>
<!--
Copyright 2019 Broadcom. The term Broadcom refers to Broadcom Inc. and/or
its subsidiaries.

Licensed under the Apache License, Version 2.0 (the "License");
you may not use this file except in compliance with the License.
You may obtain a copy of the License at

    http://www.apache.org/licenses/LICENSE-2.0

Unless required by applicable law or agreed to in writing, software
distributed under the License is distributed on an "AS IS" BASIS,
WITHOUT WARRANTIES OR CONDITIONS OF ANY KIND, either express or implied.
See the License for the specific language governing permissions and
limitations under the License.
-->

<CLISH_MODULE
    xmlns="http://www.dellemc.com/sonic/XMLSchema"
    xmlns:xsi="http://www.w3.org/2001/XMLSchema-instance"
    xmlns:xi="http://www.w3.org/2001/XInclude"
    xsi:schemaLocation="https://raw.githubusercontent.com/project-arlo/sonic-mgmt-framework/master/src/CLI/clitree/scripts/sonic-clish.xsd">

    <!--============================== CONFIG MODE COMMANDS ======================-->
    <VIEW name="configure-view">
        <!-- Global binding options -->
        <COMMAND name="hardware" help="Configure ASIC parameters" view="configure-hardware-view" data_and_render_cb="show_runn_hardware_cb"/>
    </VIEW>

    <VIEW name="configure-hardware-view" prompt="${SYSTEM_NAME}(config-hardware)# " depth="2">
        <COMMAND name="access-list" help="Configure ACL parameters" view="configure-hardware-acl-view" data_and_render_cb="show_runn_hardware_acl_cb"/>
    </VIEW>

    <VIEW name="configure-hardware-acl-view" prompt="${SYSTEM_NAME}(config-hardware-acl)# " depth="3">
        <COMMAND name="counters" help="Set ACL counters mode" data_and_render_cb="show_runn_hardware_acl_counter_cb">
            <PARAM name="counter-modes" help="" ptype="SUBCOMMAND" mode="switch">
                <PARAM name="per-entry" help="ACL counters are reported per ACL entry, aggregated across all interfaces" ptype="SUBCOMMAND" mode="subcommand" />
                <PARAM name="per-interface-entry" help="ACL counters are reported per interface and ACL entry" ptype="SUBCOMMAND" mode="subcommand" />
            </PARAM>
            <ACTION builtin="clish_pyobj">sonic_cli_acl set_counter_mode ${counter-modes}</ACTION>
        </COMMAND>
    </VIEW>

    <!--============================== EXEC MODE COMMANDS =======================-->
    <VIEW name="enable-view">
        <COMMAND name="show running-configuration hardware" help="Display current hardware configuration">
            <ACTION builtin="clish_pyobj">sonic_cli_show_config show_view views=configure-hardware</ACTION>
        </COMMAND>
        <COMMAND name="show running-configuration hardware access-list" help="Display current hardware ACL configuration">
            <ACTION builtin="clish_pyobj">sonic_cli_show_config show_view views=configure-hardware-acl</ACTION>
        </COMMAND>
    </VIEW>
</CLISH_MODULE>
